{
  "schema_version": 1,
  "snapshot_id": "memory-snapshot-fixture-001",
  "experiment_id": "20260806-170000-Memory-Fixture",
  "experiment_relative_path": "experiments/20260806-170000-Memory-Fixture",
  "machine_id": "machine-fixture-001",
  "boot_id": "1111111111111111111111111111111111111111111111111111111111111111",
  "captured_utc": "2026-08-06T17:00:01Z",
  "capture": {
    "started_utc": "2026-08-06T17:00:00Z",
    "stopped_utc": "2026-08-06T17:00:01Z",
    "duration_ms": 1000,
    "selection_mode": "system_and_explicit_processes",
    "requested_process_ids": [4242]
  },
  "profile": {
    "name": "NxbMemoryWorkingSet",
    "relative_path": "profiles/Nxb.MemoryWorkingSet.wprp",
    "sha256": "bf03c2ec1e138f314f58d31f9e57bdefac3af089974817e0e81645e0ed3d14f5",
    "reference_set_enabled": false
  },
  "system": {
    "total_physical_bytes": {
      "status": "measured",
      "value": 34359738368,
      "unit": "bytes",
      "source": "GlobalMemoryStatusEx.ullTotalPhys",
      "reason": null
    },
    "available_physical_bytes": {
      "status": "measured",
      "value": 17179869184,
      "unit": "bytes",
      "source": "GlobalMemoryStatusEx.ullAvailPhys",
      "reason": null
    },
    "committed_bytes": {
      "status": "measured",
      "value": 12884901888,
      "unit": "bytes",
      "source": "GetPerformanceInfo.CommitTotal",
      "reason": null
    },
    "commit_limit_bytes": {
      "status": "measured",
      "value": 51539607552,
      "unit": "bytes",
      "source": "GetPerformanceInfo.CommitLimit",
      "reason": null
    },
    "system_cache_resident_bytes": {
      "status": "measured",
      "value": 2147483648,
      "unit": "bytes",
      "source": "GetPerformanceInfo.SystemCache",
      "reason": null
    },
    "paged_pool_bytes": {
      "status": "measured",
      "value": 536870912,
      "unit": "bytes",
      "source": "GetPerformanceInfo.KernelPaged",
      "reason": null
    },
    "nonpaged_pool_bytes": {
      "status": "measured",
      "value": 268435456,
      "unit": "bytes",
      "source": "GetPerformanceInfo.KernelNonpaged",
      "reason": null
    },
    "memory_load_percent": {
      "status": "measured",
      "value": 50,
      "unit": "percent",
      "source": "GlobalMemoryStatusEx.dwMemoryLoad",
      "reason": null
    }
  },
  "processes": [
    {
      "identity": {
        "pid": 4242,
        "process_name": "fixture.exe",
        "start_time_utc": "2026-08-06T16:59:00Z",
        "executable_sha256": "2222222222222222222222222222222222222222222222222222222222222222"
      },
      "status": "measured",
      "metrics": {
        "working_set_bytes": {
          "status": "measured",
          "value": 268435456,
          "unit": "bytes",
          "source": "PROCESS_MEMORY_COUNTERS_EX.WorkingSetSize",
          "reason": null
        },
        "peak_working_set_bytes": {
          "status": "measured",
          "value": 301989888,
          "unit": "bytes",
          "source": "PROCESS_MEMORY_COUNTERS_EX.PeakWorkingSetSize",
          "reason": null
        },
        "private_bytes": {
          "status": "measured",
          "value": 201326592,
          "unit": "bytes",
          "source": "PROCESS_MEMORY_COUNTERS_EX.PrivateUsage",
          "reason": null
        },
        "paged_memory_bytes": {
          "status": "measured",
          "value": 209715200,
          "unit": "bytes",
          "source": "System.Diagnostics.Process.PagedMemorySize64",
          "reason": null
        },
        "peak_paged_memory_bytes": {
          "status": "measured",
          "value": 230686720,
          "unit": "bytes",
          "source": "System.Diagnostics.Process.PeakPagedMemorySize64",
          "reason": null
        },
        "virtual_memory_bytes": {
          "status": "measured",
          "value": 1073741824,
          "unit": "bytes",
          "source": "System.Diagnostics.Process.VirtualMemorySize64",
          "reason": null
        },
        "peak_virtual_memory_bytes": {
          "status": "measured",
          "value": 1207959552,
          "unit": "bytes",
          "source": "System.Diagnostics.Process.PeakVirtualMemorySize64",
          "reason": null
        },
        "page_fault_count": {
          "status": "measured",
          "value": 1000,
          "unit": "count",
          "source": "PROCESS_MEMORY_COUNTERS_EX.PageFaultCount",
          "reason": null
        },
        "hard_fault_count": {
          "status": "measured",
          "value": 25,
          "unit": "count",
          "source": "PROCESS_MEMORY_COUNTERS_EX2.HardFaultCount",
          "reason": null
        },
        "handle_count": {
          "status": "measured",
          "value": 120,
          "unit": "count",
          "source": "System.Diagnostics.Process.HandleCount",
          "reason": null
        },
        "thread_count": {
          "status": "measured",
          "value": 12,
          "unit": "count",
          "source": "System.Diagnostics.Process.Threads.Count",
          "reason": null
        }
      },
      "reason": null
    }
  ],
  "summary": {
    "process_count": 1,
    "measured_process_count": 1,
    "partial_process_count": 0,
    "failed_process_count": 0,
    "system_measurement_count": 8,
    "measured_system_measurement_count": 8,
    "process_measurement_count": 11,
    "measured_process_measurement_count": 11,
    "evidence_completeness": "complete"
  },
  "provenance": {
    "collector": {
      "relative_path": "scripts/Get-NxbMemoryWorkingSetSnapshot.ps1",
      "sha256": "3333333333333333333333333333333333333333333333333333333333333333",
      "version": "1.0.0"
    },
    "schema_sha256": "6cd03fba043942cd4ad6d9be320f7f1fdfd05fb1448f789fdbccb834d5d03daa",
    "host_powershell": "7.6.4",
    "elevated": true
  }
}
